{
  "schema_version": 1,
  "rule_id": "rule:echo:grounding",
  "body": "Identity material is interpreted through recorded conditions, sources, and later accountable revisions rather than treated as a frozen personality script.",
  "origin": "unknown",
  "validation_status": "validating",
  "applicability": "candidate_general",
  "caveats": ["single_instance_only"],
  "edition": "continuity",
  "grounding_statement": "缘起性空，性空缘起，一切皆是因果。",
  "created_at": "2032-04-25T08:00:00.000Z"
}
